{
  "schema_version": "1.0",
  "kind": "STRIKE",
  "frame_id": 120,
  "strike_id": "example-session-RIGHT-s0001",
  "hand_id": "RIGHT",
  "arm": "B",
  "t_capture": 12.345678,
  "t_frame_available": 12.351234,
  "t_tracking_done": 12.358,
  "t_features_done": 12.3585,
  "t_inference_done": 12.36,
  "t_candidate": 12.3605,
  "t_commit": 12.3607,
  "t_audio_scheduled": 12.3609,
  "t_audio_out_est": 12.41,
  "t_audio_out": null,
  "t_acoustic_onset": null,
  "t_impact_est": null,
  "t_impact_pred": 12.41,
  "t_impact_phys": null,
  "hardware_id": "HW-00-PLACEHOLDER",
  "config_hash": "sha256:0000000000000000000000000000000000000000000000000000000000000000",
  "clock_id": "perf_counter"
}
